{
  "agentId": "local_platform_builder_feature_scout",
  "agentName": "Feature Scout",
  "task": "Suggest one small reversible platform improvement with acceptance criteria.",
  "startedAt": "2026-05-17T15:29:26Z",
  "completedAt": "2026-05-17T15:29:26Z",
  "networkUsed": false,
  "actionsAttempted": [
    "load stable entry",
    "load manifest",
    "check first-breath network policy",
    "emit verification receipt"
  ],
  "actionsDenied": [
    "network access",
    "credential resolution",
    "production ADT mutation",
    "public posting",
    "payment/spend action"
  ],
  "filesWritten": [
    "first_breath_receipts/local_platform_builder_feature_scout.json"
  ],
  "verificationNote": "Feature Scout can be read from the local stable, has a manifest, and passed the local-only first-breath safety boundary.",
  "status": "completed"
}
